{
  "asr_spec_version": "0.4.0",
  "profile_id": "prf-a1c5abf26af0",
  "name": "symphony",
  "title": "Orchestras and classical music presenters",
  "description": "For work with a symphony orchestra or classical presenter: what is written about the music they play (free-to-read first), the orchestras' own seasons and self-descriptions, and nonprofit filings for finances, staff and funders, and the grant programs it can apply to. First used for Berkeley Symphony (2026-09-29).",
  "contact": "mailto:eorwyn@ucdavis.edu",
  "registries": [
    {
      "path": "../registries/music",
      "registry_id": "reg-6a6e91e4038a",
      "use": "Program and liner notes, essays, criticism, Bay Area arts press, artists' own sites and reference works. Free-to-read and mixed (per-article) sources by default.",
      "facets": {
        "reader_access": [
          "free",
          "mixed"
        ]
      }
    },
    {
      "path": "../registries/orchestras",
      "registry_id": "reg-ef568f3c30d0",
      "use": "Orchestras' own sites: seasons, programs, people, mission, press releases."
    },
    {
      "path": "../registries/nonprofit",
      "registry_id": "reg-3e245840a8bb",
      "use": "Form 990 filings and registration status: budgets, staff counts, officers, and (later) foundation grants."
    },
    {
      "path": "../registries/funders",
      "registry_id": "reg-1b402216ded8",
      "use": "Grant programs the organization can apply to: arts agencies (federal, state, county, city), community and private foundations; deadlines, eligibility, amounts, contacts, past awards."
    },
    {
      "path": "../registries/scholarly",
      "registry_id": "reg-1db286e2fa94",
      "use": "Open-access musicology and arts-management research only, when a question needs it.",
      "facets": {
        "access_model": [
          "open"
        ]
      }
    }
  ],
  "provenance": {
    "produced_by": {
      "tool": "claude-code",
      "tool_version": "",
      "model": "claude-opus-5-5",
      "method": "model",
      "person": null
    },
    "created_at": "2026-09-29T00:00:00.000Z",
    "modified_at": null
  },
  "notes": "Individual donors are out of scope by design: funders are organizations, and people appear only in public roles."
}
